{
  "source_id": "src_20260713_001_example",
  "original_filename": "example.pdf",
  "stored_path": "source_data/src_20260713_001_example/original/example.pdf",
  "media_type": "application/pdf",
  "sha256": "replace-with-file-sha256",
  "created_at": "2026-07-13T00:00:00Z",
  "status": "source_archived"
}
